,question,answer,contexts,ground_truth,context_precision,answer_relevancy,faithfulness,context_recall,context_relevancy,context_entity_recall,answer_similarity,answer_correctness
0,白石 玲奈は何歳の時にデビューしましたか？,白石 玲奈がデビューしたのは20歳の時です。,"['名前: 白石 玲奈 (Shiraishi Rena) 年齢: 28歳 生年月日: 1996年3月15日 デビューした歳: 20歳 リリースしたアルバム 1 アルバム名: 『青い夢』 (Blue Dream) リリース日: 2016年5月20日 詳細: デビューアルバムであり、瑞々しい感性と透明感あふれるボーカルで話題を呼んだ。アルバムには、青春の儚さや未来への希望を描いた曲が多く収録されており、特に「君と見'
 'の下町で生まれ育つ。幼少期から音楽に親しみ、ピアノとギターを独学で学ぶ。中学生の時に初めて作曲を始め、高校生になると地元のライブハウスで演奏するようになる。高校卒業後、音楽専門学校に進学し、本格的に音楽理論やボーカルトレーニングを学ぶ。20歳の時に自主制作アルバムをリリースし、これがレコード会社の目に留まりプロデビューを果たす。彼女の音楽は、その透明感のある声と詩的な歌詞、そして心に響くメロディで多くのファンを魅了している。出演したフェス一覧:フジロックフェスティバル (2']",20歳,0.99999999995,0.9364198648220691,1.0,1.0,0.1111111111111111,0.9999999900000002,0.42280621417853637,0.10570155354463409
1,2枚目にリリースしたアルバムのタイトルは何ですか？,2枚目にリリースされたアルバムのタイトルは「永遠の一瞬」です。,"['リリースしたアルバム 2アルバム名: 『流星の詩』 (Meteor Poem)リリース日: 2018年9月12日 詳細: セカンドアルバムで、より成熟した音楽性と深みのある歌詞が特徴。人生の様々な局面や感情を詩的に表現した楽曲が揃っており、「夜空に咲く花」がシングルとしてリリースされ、大人のリスナーからも支持を得た。アルバム全体を通じて、一貫したテーマとして「変化」と「成長」が描かれている。'
 'の下町で生まれ育つ。幼少期から音楽に親しみ、ピアノとギターを独学で学ぶ。中学生の時に初めて作曲を始め、高校生になると地元のライブハウスで演奏するようになる。高校卒業後、音楽専門学校に進学し、本格的に音楽理論やボーカルトレーニングを学ぶ。20歳の時に自主制作アルバムをリリースし、これがレコード会社の目に留まりプロデビューを果たす。彼女の音楽は、その透明感のある声と詩的な歌詞、そして心に響くメロディで多くのファンを魅了している。出演したフェス一覧:フジロックフェスティバル (2']", 『流星の詩』 (Meteor Poem),0.9999999999,0.9877536262768821,0.0,1.0,0.1,0.999999995,0.32455318982460646,0.08104749954729334
2,2019年に出演したフェスは何ですか？,ロック・イン・ジャパン・フェスとコーチェラ・フェスティバルに出演しました。 ,"['名前: 白石 玲奈 (Shiraishi Rena) 年齢: 28歳 生年月日: 1996年3月15日 デビューした歳: 20歳 リリースしたアルバム 1 アルバム名: 『青い夢』 (Blue Dream) リリース日: 2016年5月20日 詳細: デビューアルバムであり、瑞々しい感性と透明感あふれるボーカルで話題を呼んだ。アルバムには、青春の儚さや未来への希望を描いた曲が多く収録されており、特に「君と見'
 'の下町で生まれ育つ。幼少期から音楽に親しみ、ピアノとギターを独学で学ぶ。中学生の時に初めて作曲を始め、高校生になると地元のライブハウスで演奏するようになる。高校卒業後、音楽専門学校に進学し、本格的に音楽理論やボーカルトレーニングを学ぶ。20歳の時に自主制作アルバムをリリースし、これがレコード会社の目に留まりプロデビューを果たす。彼女の音楽は、その透明感のある声と詩的な歌詞、そして心に響くメロディで多くのファンを魅了している。出演したフェス一覧:フジロックフェスティバル (2']",フジロックフェスティバルとコーチェラ・フェスティバル ,0.0,0.5399029959448155,0.0,0.0,0.1111111111111111,0.4999999975,0.6875186523309621,0.547130153389466
